<?xml version = "1.0" encoding = "ISO-8859-1"?>

<!DOCTYPE controladores SYSTEM "dtds/controladores.dtd">

<!-- 
Documentación sobre controladores: 
https://www.openxava.org/OpenXavaDoc/docs/controllers_es.html

Controladores por defecto, incluidos en OpenXava (puedes extender de ellos):
https://github.com/openxava/openxava/blob/master/openxava/src/main/resources/xava/default-controllers.xml
 
Ejemplos de controladores (de la aplicación de pruebas):
https://github.com/openxava/openxava/blob/master/openxavatest/src/main/resources/xava/controllers.xml
-->

<controladores>
    
    <!-- Variable de entorno: 
    <var-entorno nombre="tuaplicacion_ANYO_DEFECTO" valor="2015"/>
    -->
    
    <!-- Objeto de sesión:
    <Objeto nombre="tuaplicacion_anyoActivo" clase="java.lang.Integer" valor="2015" 
            ambito="global"/>
    -->
    
    <!-- Controlador:
    <controlador nombre="Profesor">
        <hereda-de controlador="Typical"/>
        <accion nombre="new" icono="plus-box-multiple" atajo-de-teclado="Control N" 
                clase="acciones.CrearProfesor"/>        
    </controlador>
    -->
    
    <controlador nombre="IncidenciasVersion">
    	<accion nombre="new" oculta="true"
			icono="plus-box-multiple"
			clase="com.tuempresa.tuaplicacion.acciones.CrearNuevaIncidenciaEnVersion"/>
	</controlador>
    
    <controlador nombre="MiCalendario">
		<hereda-de controlador="CRUD"/>
		
		<accion nombre="new" 
			clase="com.tuempresa.tuaplicacion.acciones.CrearNuevaIncidenciaDesdeMiCalendario"
			imagen="new.gif"
			icono="plus-box-multiple"
			atajo-de-teclado="Control N"
			pierde-datos-cambiados="true">
			<poner propiedad="restoreModel" valor="true"/>						
		</accion>
		
		<accion nombre="save" modo="detail"
			por-defecto="si-posible"
			clase="com.tuempresa.tuaplicacion.acciones.GuardarVolviendoALista"
			imagen="save.gif"
			icono="content-save"
			atajo-de-teclado="Control S"/>
			
	</controlador>
    
</controladores>
